id,question_en,question_ar,step_no,required,type,answer_en_1,answer_ar_1,answer_en_2,answer_ar_2,answer_en_3,answer_ar_3,answer_en_4,answer_ar_4,answer_en_5,answer_ar_5,answer_en_6,answer_ar_6,answer_en_7,answer_ar_7,answer_en_8,answer_ar_8,answer_en_9,answer_ar_9,answer_en_10,answer_ar_10,answer_en_11,answer_ar_11,answer_en_12,answer_ar_12,answer_en_13,answer_ar_13,answer_en_14,answer_ar_14,answer_en_15,answer_ar_15,answer_en_16,answer_ar_16,answer_en_17,answer_ar_17,answer_en_18,answer_ar_18,answer_en_19,answer_ar_19,answer_en_20,answer_ar_20
1,"Based on your recent visit to Al Rajhi Bank's branch, how likely are you to recommend Al Rajhi Bank banking experience to a friend, relative or colleague?","بناءً على زيارتك الأخيرة لفرع مصرف الراجحي، ما احتمالية أن توصي أحد أصدقائك أو أقاربك أو زملائك بتجربتك مع الخدمات المصرفية التي يقدمها مصرف الراجحي وفقًا لمقياس النقاط من صفر-10؟  الرجاء الإجابة على السؤال باستخدام المقياس التالي",1,TRUE,RADIO,0 Not At All Likely,0 لا أنصح,1,1,2,2,3,3,4,4,5,5,6,6,7,7,8,8,9,9,10 Extremely Likely,10 أنصح بشدة,,,,,,,,,,,,,,,,,,
2, Please specify the reason behind rating Al Rajhi Bank this score,يرجى ذكر السبب الذي جعلك تختار هذا التقييم من القائمة أدناه,2,TRUE,CHECKBOX_WITH_COMMENTS,Staff's lack of knowledge,قلة معرفة الموظفين عن الخدمات والمنتجات,Poor staff attitude,سلوك سيئ من الموظف,Poor staff communication,طريقة تواصل الموظف غير مريحة ,Unhelpful staff,الموظف غير متساعد ,Not welcomed suitably,لم يتم الترحيب بي بشكل مناسب ,staff was distracted or on mobile,الموظف منشغل وقت خدمتي (بالجوال او شي اخر)  ,staff directed me to another counter / branch,وجهني الموظف الى موظف اخر او لأقرب فرع,Crowded Branch,ازدحام الفرع ,Branch not clean or hygienic,الفرع غير نظيف أو صحي,Branch temperature too high / low,درجة حرارة الفرع مرتفعة \ منخفضة للغاية ,Waiting time unacceptable,وقت الانتظار غير مقبول,Waiting area uncomfortable,منطقة الانتظار غير مريحه ,Poor branch standards & maintenance,معايير وصيانة الفرع سيئة ,Poor adaptation for disability,الفرع غير مجهز لاستقبال لذوي الاحتياجات الخاصه,System down,تعطل النظام,Printers are not working,عدم عمل الطابعات ,"Process delay, longer than promised",تأخر في الاجراء وتنفيذ العمليه ,Service wait time unacceptable,الوقت المستغرق لتنفيذ الخدمة (العملية) غير مقبول,Inappropriate Fees / charges / profit rate,الرسوم / تكاليف / معدل الربح عاليه ,Any valuable suggestion to help us serve you better?,هل يوجد لديك أي إقتراحات تساعدنا علي خدمتك بشكل أحسن ؟
3,To what extent would you say you are satisfied or dissatisfied about your recent visit? ,الى أي مدى تقول انك راضي او غير راضي عن زيارتك االاخيره للفرع؟,3,TRUE,RADIO,Extremely Satisfied,راضي للغاية ,Somewhat Satisfied,راضي نوعا ما ,Neutral,محايد - لست راضي او غير راضي ,Somewhat Disatisfied,غير راضي نوعا ما,Extremely Disatisfied,غير راضي على الاطلاق,,,,,,,,,,,,,,,,,,,,,,,,,,,,,,
4, How much effort did you personally have to put to execute your banking transaction through your visit,كيف تقيم مقدار الجهد الذي بذلته لتقديم طلبك او تنفيذ عملية مصرفية خلال الزيارة؟,4,TRUE,RADIO,Very easy,سهل جدا,Easy,سهل,Neutral,محايد,Difficult,صعب,Very Diffcult,صعب جدا,,,,,,,,,,,,,,,,,,,,,,,,,,,,,,
5,Do you got the requested service from the first visit?,هل تمت خدمتك بالشكل المطلوب من أول زياره لك للفرع؟,5,TRUE,RADIO,Yes,نعم,No,لا,,,,,,,,,,,,,,,,,,,,,,,,,,,,,,,,,,,,
6,"Thank you, Please follow us on","شكرا لك ، يرجى متابعتنا",6,FALSE,LABEL,,,,,,,,,,,,,,,,,,,,,,,,,,,,,,,,,,,,,,,,
